{
  "schema_version": "1.0",
  "repo_id": "forge-command",
  "repo_name": "ForgeCommand",
  "repo_archetype": "desktop_app_repo",
  "authority_order": [
    "contract_schema",
    "code_runtime",
    "test_verification",
    "repo_truth_doc",
    "protocol_doc"
  ],
  "approved_source_families": [
    "code_runtime",
    "contract_schema",
    "test_verification",
    "repo_truth_doc",
    "protocol_doc"
  ],
  "disallowed_source_families": [
    "generated_output",
    "advisory_note"
  ],
  "ambiguity_rules": [
    "code_vs_repo_truth_doc_conflict_blocks",
    "protocol_vs_runtime_conflict_requires_review"
  ],
  "escalation_required_conditions": [
    "authority_conflict_on_required_truth"
  ],
  "approved_derivation_scope": [
    "repo_navigation_map",
    "key_file_packet",
    "validation_command_packet"
  ],
  "operator_review_required_conditions": [
    "authority_ambiguity"
  ],
  "notes_on_known_authority_gaps": "Initial proof-slice record.",
  "created_at": "2026-04-09T00:00:00-04:00",
  "last_reviewed_at": "2026-04-09T00:00:00-04:00"
}
